{
  "mqtt": {
    "host": "localhost",
    "port": 9001,
    "data_topic": "data_topic",
    "log_topic": "log_topic"
  },

  "mongodb": {
    "host": "localhost",
    "port": 23023,
    "db": "eagletrt",
    "collection": "scimmera"
  },

  "gps": {
    "plugged": 0,
    "simulated": 1,
    "interface": "/dev/pts/23"
  },

  "pilots": [
    "default",
    "Schumacher",
    "Senna",
    "Leclerc",
    "Hamilton",
    "Euber"
  ],

  "races": [
      "default",
      "Hellpad",
      "Skipass"
  ],

  "circuits": [
    "default",
    "Imola",
    "Povo"
  ],

  "can_interface": "vcan0",
  "sending_rate": 250,
  "verbose": 1
}
